id_startup,nome_startup,descricao,estagio,setor,capital_aportado,tokens_emitidos,socios,participacao_societaria,mentores_conselho,video_demo,status
MESCLA-001,AgriSense Tecnologia,"Plataforma de monitoramento inteligente para agricultura de precisão, utilizando sensores IoT e análise de dados para otimizar irrigação, aplicação de insumos e produtividade rural.",em_operacao,AgTech,280000,100000,"Lucas Ferreira; Mariana Costa; Pedro Almeida","45%; 35%; 20%","Prof. Dr. Roberto Siqueira; Dra. Ana Ribeiro (Embrapa)",https://youtube.com/watch?v=demo-agrisense,ativo
MESCLA-002,EduPath Soluções,"Aplicativo de trilhas de aprendizagem personalizadas com IA generativa para estudantes universitários, gamificando o processo de estudo e adaptando o conteúdo ao ritmo de cada aluno.",nova,EdTech,75000,50000,"Beatriz Lima; Carlos Mendonça","60%; 40%","Prof. Me. Fernanda Souza",https://youtube.com/watch?v=demo-edupath,ativo
MESCLA-003,MedTrack Health,"Sistema integrado de rastreamento de pacientes e gestão de prontuários eletrônicos para clínicas e consultórios de pequeno e médio porte, com alertas automáticos e telemedicina.",em_expansao,HealthTech,620000,200000,"Juliana Nascimento; Rafael Torres; Amanda Vieira; Diego Santos","30%; 30%; 25%; 15%","Dr. Marcos Pinto (CFM-SP); Prof. Dra. Carla Oliveira; Eng. Paulo Freitas",https://youtube.com/watch?v=demo-medtrack,ativo
MESCLA-004,GreenLoop Ambiental,"Marketplace de créditos de carbono voluntários que conecta empresas a projetos de reflorestamento certificados no interior de São Paulo, com rastreabilidade completa via QR code.",nova,CleanTech,50000,40000,"Thiago Barros; Isabela Rocha","55%; 45%","Prof. Dr. Eduardo Campos (PUCCAMP)",https://youtube.com/watch?v=demo-greenloop,ativo
MESCLA-005,FinFlux Tecnologia Financeira,"Plataforma de gestão financeira pessoal com análise preditiva de gastos, metas automatizadas e recomendações de investimento personalizadas para jovens adultos entre 18 e 35 anos.",em_operacao,FinTech,390000,150000,"Rodrigo Matos; Priscila Andrade; Felipe Cunha","40%; 35%; 25%","Prof. Me. Sandra Lima; Eng. Alexandre Costa (XP Inc.)",https://youtube.com/watch?v=demo-finflux,ativo
